{
  "case_id": "case_a9ae5abf43ae",
  "generated_at": "2026-02-17T22:05:10+00:00",
  "ruleset_version": "active",
  "results": [
    {
      "measure_id": "envelope_fenster",
      "status": "PASS",
      "reason": "all_checks_passed",
      "used_evidence": [
        {
          "doc_id": "offer",
          "page": 1,
          "quote": "Mail : stefan.jansen@neunkirchen-fensterbau.de",
          "bbox": null,
          "source_path": null
        },
        {
          "doc_id": "offer",
          "page": 1,
          "quote": "2. Angebot mit zus\u00e4tzlich Pos. 14 und Hinweis Absturzsicherung im Vortex",
          "bbox": null,
          "source_path": null
        },
        {
          "doc_id": "offer",
          "page": 1,
          "quote": "INOUTIC/Thyssen Kunststoff-Fenster Profil System EFORTE Mitteldichtung fl\u00e4chenversetzt,",
          "bbox": null,
          "source_path": null
        },
        {
          "doc_id": "offer",
          "page": 1,
          "quote": "komplett mit W\u00e4rmeschutzglas 0,6 Ug als Dreifachglas mit warmer Kante",
          "bbox": null,
          "source_path": null
        },
        {
          "doc_id": "offer",
          "page": 1,
          "quote": "Farbe wei\u00df, liefern und montieren",
          "bbox": null,
          "source_path": null
        },
        {
          "doc_id": "offer",
          "page": 1,
          "quote": "Absturzsicherung inkl Montage",
          "bbox": null,
          "source_path": null
        },
        {
          "doc_id": "offer",
          "page": 1,
          "quote": "Demontage Altfenster und Entsorgung.",
          "bbox": null,
          "source_path": null
        },
        {
          "doc_id": "offer",
          "page": 2,
          "quote": "Uw-Wert 0.80 W/m\u00b2K",
          "bbox": null,
          "source_path": null
        },
        {
          "doc_id": "offer",
          "page": 2,
          "quote": "Montage 918,00 2754,00",
          "bbox": null,
          "source_path": null
        },
        {
          "doc_id": "offer",
          "page": 2,
          "quote": "Uw-Wert 0.79 W/m\u00b2K",
          "bbox": null,
          "source_path": null
        },
        {
          "doc_id": "offer",
          "page": 2,
          "quote": "Montage 1097,00 1097,00",
          "bbox": null,
          "source_path": null
        },
        {
          "doc_id": "offer",
          "page": 3,
          "quote": "Uw-Wert 0.80 W/m\u00b2K",
          "bbox": null,
          "source_path": null
        },
        {
          "doc_id": "offer",
          "page": 3,
          "quote": "Montage\t918,00\t1836,00",
          "bbox": null,
          "source_path": null
        },
        {
          "doc_id": "offer",
          "page": 3,
          "quote": "normalem Zubeh\u00f6r, liefern und montieren\t68,00\t897,60",
          "bbox": null,
          "source_path": null
        },
        {
          "doc_id": "offer",
          "page": 3,
          "quote": "liefern und montieren",
          "bbox": null,
          "source_path": null
        },
        {
          "doc_id": "offer",
          "page": 3,
          "quote": "nach Aufwand, Material und Arbeitszeit)\t168,00\t1008,00",
          "bbox": null,
          "source_path": null
        },
        {
          "doc_id": "offer",
          "page": 4,
          "quote": "7\t8,70 lfm.\tca. Bestehenden Rolladenkasten mit Styrodur d\u00e4mmen\t45,00\t\t391,50",
          "bbox": null,
          "source_path": null
        },
        {
          "doc_id": "offer",
          "page": 4,
          "quote": "8\t6 St\u00fcck\tAusbau und Entsorgung der alten Elemente\t70,00\t\t420,00",
          "bbox": null,
          "source_path": null
        },
        {
          "doc_id": "offer",
          "page": 4,
          "quote": "mit Rolladenkasten \u00f6ffnen und schlie\u00dfen\t81,00\t\t486,00",
          "bbox": null,
          "source_path": null
        },
        {
          "doc_id": "offer",
          "page": 4,
          "quote": "10\t30,00 lfm.\tca. Fensteranschlu\u00dffugen werden",
          "bbox": null,
          "source_path": null
        },
        {
          "doc_id": "offer",
          "page": 4,
          "quote": "mit dem bew\u00e4hrten PU-Schaum ge-",
          "bbox": null,
          "source_path": null
        },
        {
          "doc_id": "offer",
          "page": 4,
          "quote": "eine andere Ausf\u00fchrung an)\t6,00\t\t180,00",
          "bbox": null,
          "source_path": null
        },
        {
          "doc_id": "offer",
          "page": 4,
          "quote": "12\t30,00 lfm.\tca. Versiegelung liefern und montieren\t8,00\t\t240,00",
          "bbox": null,
          "source_path": null
        },
        {
          "doc_id": "offer",
          "page": 4,
          "quote": "Fl\u00fcgel und obere Festverglasung Frontseite\t925,00\t\t925,00",
          "bbox": null,
          "source_path": null
        },
        {
          "doc_id": "offer",
          "page": 5,
          "quote": "15\t8 St\u00fcck\tAbsturzsicherung in bestehende Fensterfassade inkl liefern und Montieren.\t155,00\t1240,00",
          "bbox": null,
          "source_path": null
        },
        {
          "doc_id": "offer",
          "page": 5,
          "quote": "17\t1 St\u00fcck\tFensterb\u00e4nke f\u00fcr neue Fenster liefern und montieren.\t425,68\t425,68",
          "bbox": null,
          "source_path": null
        }
      ],
      "questions": [],
      "cost_summary": {
        "eligible_total": 11240.78,
        "ineligible_total": 0.0,
        "conditional_total": 660.0,
        "items": [
          {
            "description": "Montage",
            "category": "montage",
            "amount": 2754.0,
            "decision": "ELIGIBLE"
          },
          {
            "description": "Montage",
            "category": "montage",
            "amount": 1097.0,
            "decision": "ELIGIBLE"
          },
          {
            "description": "Montage",
            "category": "montage",
            "amount": 1836.0,
            "decision": "ELIGIBLE"
          },
          {
            "description": "normalem Zubeh\u00f6r, liefern und montieren",
            "category": "material",
            "amount": 897.6,
            "decision": "ELIGIBLE"
          },
          {
            "description": "nach Aufwand, Material und Arbeitszeit)",
            "category": "material",
            "amount": 1008.0,
            "decision": "ELIGIBLE"
          },
          {
            "description": "ca. Bestehenden Rolladenkasten mit Styrodur d\u00e4mmen",
            "category": "material",
            "amount": 391.5,
            "decision": "ELIGIBLE"
          },
          {
            "description": "Ausbau und Entsorgung der alten Elemente",
            "category": "entsorgung",
            "amount": 420.0,
            "decision": "UNCLASSIFIED"
          },
          {
            "description": "mit Rolladenkasten \u00f6ffnen und schlie\u00dfen",
            "category": "material",
            "amount": 486.0,
            "decision": "ELIGIBLE"
          },
          {
            "description": "eine andere Ausf\u00fchrung an)",
            "category": "material",
            "amount": 180.0,
            "decision": "ELIGIBLE"
          },
          {
            "description": "ca. Versiegelung liefern und montieren",
            "category": "montage",
            "amount": 240.0,
            "decision": "ELIGIBLE_IF_NECESSARY"
          },
          {
            "description": "Fl\u00fcgel und obere Festverglasung Frontseite",
            "category": "material",
            "amount": 925.0,
            "decision": "ELIGIBLE"
          },
          {
            "description": "Absturzsicherung in bestehende Fensterfassade inkl liefern und Montieren.",
            "category": "montage",
            "amount": 1240.0,
            "decision": "ELIGIBLE"
          },
          {
            "description": "Fensterb\u00e4nke f\u00fcr neue Fenster liefern und montieren.",
            "category": "material",
            "amount": 425.68,
            "decision": "ELIGIBLE"
          }
        ]
      }
    },
    {
      "measure_id": "envelope_aussenwand",
      "status": "CLARIFY",
      "reason": "missing_wall_layers",
      "used_evidence": [
        {
          "doc_id": "offer",
          "page": 5,
          "quote": "_\t16\t1 St\u00fcck\tFassadend\u00e4mmung inkl Putzarbeiten und Malerarbeiten durch Firma Gruber\t3250,00\t3250,00",
          "bbox": null,
          "source_path": null
        }
      ],
      "questions": [
        "Bitte U-Wert nach Sanierung ODER Daemmstaerke + Material (lambda) + Wandaufbau nachreichen."
      ],
      "cost_summary": {}
    }
  ]
}
